{
  "id": "module-5",
  "title": "Chapter 3: Biochemistry Basics — Summary",
  "objectives": [
    "Recall the key equations from thermodynamics, kinetics, redox, and acid/base chemistry covered in Chapter 3",
    "Connect high-yield facts across the four major topics into one review",
    "Use the chapter summary to identify which prior module to revisit for a given fact"
  ],
  "sections": [
    {
      "id": "section-1",
      "title": "Overview",
      "content": "This chapter covers foundational biochemistry concepts tested on the MCAT: thermodynamics, kinetics, redox reactions, and acid/base chemistry. The source material for this chapter is the Princeton Review MCAT Biochemistry Review, Chapter 3.",
      "sourceRefs": [
        "wiki/course/context/module-5-context.md:20",
        "wiki/course/context/module-5-context.md:99"
      ]
    },
    {
      "id": "section-2",
      "title": "Major Topics Recap",
      "content": "Thermodynamics: Gibbs free energy is ∆G = ∆H – T∆S; ∆G < 0 is spontaneous (exergonic) and ∆G > 0 is nonspontaneous (endergonic); standard free energy is ∆G°′ = –RT ln K'_eq (at pH 7, 1 M solutes); actual cellular ∆G = ∆G°′ + RT ln Q; Le Châtelier's principle governs how Q versus K_eq drives reaction direction; two factors determine spontaneity in cells — intrinsic properties (K_eq) and concentrations (RT ln Q). Kinetics: thermodynamics is not the same as kinetics, since ∆G says nothing about rate; activation energy (E_a) is the barrier to reaching the transition state [TS]‡; catalysts and enzymes lower E_a by stabilizing the transition state but do not change ∆G or K_eq; enzymes are biological catalysts with a kinetic role only. Oxidation-reduction: oxidation is loss of electrons/hydrogen or gain of oxygen, reduction is gain of electrons/hydrogen or loss of oxygen; redox pairs always have one species oxidized and one reduced; in metabolism, catabolism is oxidative and releases energy while anabolism is reductive and requires ATP; glucose oxidation is C₆H₁₂O₆ + 6 O₂ → 6 CO₂ + 6 H₂O. Acids and bases: under Brønsted-Lowry, an acid is an H⁺ donor and a base is an H⁺ acceptor; under Lewis, an acid is an electron-pair acceptor and a base is an electron-pair donor; conjugate pairs differ by one H⁺; a lower pK_a means a stronger acid and a lower pK_b means a stronger base; amphoteric substances (such as HCO₃⁻ and amino acids) can act as either acid or base; pH = –log[H⁺] and pH + pOH = 14 at 25°C; buffers contain a weak acid plus its conjugate base to resist pH change; the bicarbonate buffer (CO₂ + H₂O ⇌ H₂CO₃ ⇌ H⁺ + HCO₃⁻) is key in blood.",
      "sourceRefs": [
        "wiki/course/context/module-5-context.md:26-55"
      ]
    },
    {
      "id": "section-3",
      "title": "High-Yield Facts for MCAT",
      "content": "ATP is the primary energy currency, storing energy in high-energy phosphate bonds. ∆G < 0 means spontaneous, and ∆G = 0 means equilibrium. Enzymes lower activation energy (E_a) but do not change ∆G or K_eq. Catalysts speed up both forward and reverse reactions equally. Redox reactions follow the mnemonic OIL RIG (Oxidation Is Loss, Reduction Is Gain). A lower pK_a means a stronger acid, and a higher pK_a means a weaker acid (more basic). The bicarbonate buffer is the main blood buffer, and CO₂ accumulation causes pH to drop. Amphoteric substances such as HCO₃⁻ and amino acids can either donate or accept H⁺.",
      "sourceRefs": [
        "wiki/course/context/module-5-context.md:75-82"
      ]
    }
  ],
  "equations": [
    {
      "expression": "∆G = ∆H – T∆S",
      "meaning": "Thermodynamic spontaneity equation, relating free energy, enthalpy, and entropy.",
      "sourceRefs": [
        "wiki/course/context/module-5-context.md:63"
      ]
    },
    {
      "expression": "∆G°′ = –RT ln K'_eq",
      "meaning": "Relates standard free energy change to the equilibrium constant.",
      "sourceRefs": [
        "wiki/course/context/module-5-context.md:64"
      ]
    },
    {
      "expression": "∆G = ∆G°′ + RT ln Q",
      "meaning": "Gives the actual cellular ∆G from standard free energy and the reaction quotient.",
      "sourceRefs": [
        "wiki/course/context/module-5-context.md:65"
      ]
    },
    {
      "expression": "pH = –log[H⁺]",
      "meaning": "Defines acidity in terms of hydrogen ion concentration.",
      "sourceRefs": [
        "wiki/course/context/module-5-context.md:66"
      ]
    },
    {
      "expression": "pH + pOH = 14",
      "meaning": "Acid-base relationship at 25°C.",
      "sourceRefs": [
        "wiki/course/context/module-5-context.md:67"
      ]
    },
    {
      "expression": "pK_a = –log K_a",
      "meaning": "Converts the acid dissociation constant into pK_a, a measure of acid strength.",
      "sourceRefs": [
        "wiki/course/context/module-5-context.md:68"
      ]
    },
    {
      "expression": "pK_b = –log K_b",
      "meaning": "Converts the base dissociation constant into pK_b, a measure of base strength.",
      "sourceRefs": [
        "wiki/course/context/module-5-context.md:69"
      ]
    }
  ],
  "workedExamples": [
    {
      "question": "Using the chapter's high-yield facts, if an enzyme is added to a reaction, what happens to ∆G and K_eq?",
      "steps": [
        "Recall the high-yield fact: enzymes lower E_a but do not change ∆G or K_eq",
        "An enzyme is a biological catalyst, and catalysts have a purely kinetic role",
        "Therefore adding the enzyme leaves ∆G and K_eq unchanged"
      ],
      "answer": "Neither ∆G nor K_eq changes; the enzyme only lowers the activation energy and increases the rate.",
      "sourceRefs": [
        "wiki/course/context/module-5-context.md:77"
      ]
    }
  ],
  "checks": [
    {
      "question": "Is the following statement true or false, according to the chapter summary? 'Catalysts speed up the forward reaction more than the reverse reaction.'",
      "answer": "False",
      "explanation": "The chapter summary states catalysts speed up both forward and reverse reactions equally.",
      "sourceRefs": [
        "wiki/course/context/module-5-context.md:78"
      ],
      "reviewTarget": "high-yield facts for MCAT"
    },
    {
      "question": "According to the high-yield facts, what happens to pH when CO₂ accumulates in the blood?",
      "answer": "pH drops",
      "explanation": "The chapter summary states the bicarbonate buffer is the main blood buffer and CO₂ accumulation causes pH to drop.",
      "sourceRefs": [
        "wiki/course/context/module-5-context.md:81"
      ],
      "reviewTarget": "high-yield facts for MCAT"
    },
    {
      "question": "Which two substances are given in the chapter summary as examples of amphoteric substances?",
      "choices": [
        "HCO₃⁻ and amino acids",
        "Glucose and ATP",
        "H₂O and OH⁻ only",
        "CO₂ and O₂"
      ],
      "answer": "HCO₃⁻ and amino acids",
      "explanation": "The summary lists HCO₃⁻ and amino acids as examples of amphoteric substances that can donate or accept H⁺.",
      "sourceRefs": [
        "wiki/course/context/module-5-context.md:82"
      ],
      "reviewTarget": "high-yield facts for MCAT"
    }
  ],
  "practiceQuestions": [
    {
      "question": "According to the chapter summary's Major Topics, which equation governs the actual free energy change in a cell?",
      "choices": [
        "∆G = ∆H – T∆S",
        "∆G°′ = –RT ln K'_eq",
        "∆G = ∆G°′ + RT ln Q",
        "pH = –log[H⁺]"
      ],
      "answer": "∆G = ∆G°′ + RT ln Q",
      "explanation": "The Major Topics section lists 'Actual cellular ∆G: ∆G = ∆G°′ + RT ln Q' under thermodynamics.",
      "sourceRefs": [
        "wiki/course/context/module-5-context.md:30"
      ],
      "reviewTarget": "major topics recap"
    },
    {
      "question": "Per the chapter summary, what two factors determine spontaneity of a reaction in a cell?",
      "answer": "Intrinsic properties (K_eq) and concentrations (RT ln Q)",
      "explanation": "The Major Topics section under thermodynamics states this is the key takeaway: two factors determine spontaneity in cells.",
      "sourceRefs": [
        "wiki/course/context/module-5-context.md:32"
      ],
      "reviewTarget": "major topics recap"
    },
    {
      "question": "What is the source cited for this chapter's content?",
      "answer": "Princeton Review MCAT Biochemistry Review, Chapter 3",
      "explanation": "The article explicitly cites this as its source at the end of the chapter summary.",
      "sourceRefs": [
        "wiki/course/context/module-5-context.md:99"
      ],
      "reviewTarget": "overview"
    }
  ],
  "sourceRefs": [
    "wiki/course/context/module-5-context.md",
    "wiki/chapter-3-summary.md",
    "wiki/.understand-anything/knowledge-graph.json"
  ],
  "sourceGaps": []
}
